Point,Weather,WaterTemp,Quantity,Comment,Tide,Time
daikoku,雨,17.0,130.0,本日の大黒は北寄りの風が強く、予報よりも雨の降る時間が長い寒い日となりました。釣果ではコブダイこそ出ましたが、全体的に寂しい結果となりました。明日は晴れるようですが、北寄りの風は残りそうです。,小潮,2021-04-05 19:15:00
honmoku,雨,16.0,102.0,,小潮,
isogo,雨,16.5,72.0,北東の風が一日強く途中雨も降り、釣りづらい一日となりました。釣果はサビキ釣りが良かった様で、アジ、イワシ、コノシロが釣れていました。南桟橋で、アジ、イワシ、ウミタナゴ、カサゴ、クロダイ、コノシロ、メジナ、メバルが中央桟橋で、アジ、イワシ、コノシロが東桟橋では、カサゴ、タコが釣れました。,小潮,2021-04-05 18:30:00
daikoku,曇,16.0,222.0,暖かさに体が慣れてしまったせいか、北寄りの風が冷たく感じる一日となりました。釣果の方は上向きになってきたようでクロダイが17匹も釣れ、バラシも多数あったようです。サビキ釣りもアジ、イワシ、コノシロ共に数を伸ばしています。また、待っていた方も多いと思われるシリヤケイカが8杯上がっています。ナイトゲームのメバル・カサゴですが、良型も出始めていますのでヘッドライト等の照明器具をご用意の上、狙ってみて下さい。明日は太陽が顔を出し南寄りの風が吹くようですが、気温は15°C止まりの予報になっていますので、防寒の用意があると安心です。,長潮,2021-04-06 19:32:00
honmoku,曇,16.0,127.0,,長潮,
isogo,曇,16.0,116.0,昨日の雨も上がり、晴れて北東の風がやや強く吹いて肌寒い一日でした。釣果は南桟橋でメジナが数多く釣れ、多い方で39匹と爆釣された方も居られました。また、アジは一部の場所で数釣れていました。南桟橋で、アジ、ウミタナゴ、カサゴ、コノシロ、メジナ、メバル、タコ等中央桟橋で、アジ、カサゴ、サバ、ハゼ等東桟橋では、カサゴ、シロギス、メジナ、メバル、メゴチが釣れました。,長潮,2021-04-06 18:28:00
daikoku,晴,16.0,262.0,日中は暖くなりましたが、朝夕は風が冷たく上着が必要な一日となりました。釣果の方はサビキでは、イワシが桟橋外側で釣れ始め、最終的には内外両側で、1人で100匹を超える釣果をお持ちの方が数名いました。クロダイが本日も好調で18匹釣れ、シリヤケイカが10杯と昨日に続き釣果が出始めています。ナイトゲームのメバル・カサゴですが、年間大物賞候補の29cmメバルが上がっています。ナイトゲームをされますお客様は、ヘッドライト等の照明器具をご用意の上お越し下さい。明日は一日晴れ、最高気温は19°Cとなっております。朝夕は、まだ寒さを感じますので上着が必要です。,若潮,2021-04-07 19:43:00
honmoku,晴,15.5,124.0,,若潮,
isogo,晴,16.0,141.0,若干風が吹いていましたが、日中は天気も良く釣り日和でした。釣果は、数日メジナの活性が高く絶好調です。アジもわりと良く場所は限定されますが出ています。南桟橋で、アジ、カサゴ、クロダイ、サバ、コノシロ、メジナ、メバル、等中央桟橋で、アジ、タコ等東桟橋では、カサゴ、クロダイ、タコ、フッコ、メジナ、メバルが釣れました。,若潮,2021-04-07 18:25:00
daikoku,晴,16.0,176.0,南寄りの風が時折強めに吹く時間帯もありましたが、この時期らしい気候となりました。まだ上着があった方が安心なようです。釣果ですが、魚種は数多くなりましたが、昨日まで好調だったクロダイやサビキ釣りの釣果が伸び悩みました。アジも場所限定で一人で20匹ほど釣られていましたので当たり外れが大きかった様です。シリヤケイカ狙いのエギンガーの皆様はそこそこ楽しめたようです。ナイトゲームのカサゴ・メバルは本日も良型が釣れています。明日は北の風に変わり気温は14°Cまでしか上がらない予報になっておりますので厚着がお勧めです。,中潮,2021-04-08 19:40:00
honmoku,晴,15.0,97.0,,中潮,
isogo,晴,16.0,117.0,午後2時くらいから南西の風が強めに吹いてしまいましたが、日中は天気も良く釣り日和でした。釣果は、南桟橋で、アジ、イワシ、ウミタナゴ、カサゴ、カレイ、クロダイ、サバ、コノシロ、タコ、メジナ、メバル、等中央桟橋で、ヒラメ等東桟橋では、カサゴ、クロダイ、シロギス、ソイ、タコ、メゴチ、メジナ等が釣れました。,中潮,2021-04-08 18:17:00
daikoku,晴,16.0,185.0,閉場間際に少し雨がぱらつきましたが日中は時々太陽も顔を出して釣り易い一日となりました。釣果は場所によりバラつきがありますがアジが朝夕に釣れ、数を伸ばした方もいらっしゃいました。サビキ釣りのシコイワシは残念ながら、あまり群れが回ってきてくれませんでした。エギングのシリヤケイカがいよいよシーズンインし毎日釣果が伸びていますが、明日は予約状況から開場早々「釣り方制限」になる可能性が高くなっています。「釣り方制限」になった場合はアンダースローでの投入となります。ご了承下さい。,中潮,2021-04-09 19:30:00
honmoku,晴,,95.0,,中潮,
isogo,晴,16.0,116.0,終日晴れとなる予報でしたが、閉場間際に残念ながら雨がこぼれて来てしまいました。釣果は南桟橋で、アジ、イワシ、ウミタナゴ、カサゴ、クロダイ、コノシロ、フグ、メジナ、メバル等が、中央で、アジ、イシモチが東桟橋では、アジ、イイダコ、ウミタナゴ、カサゴ、コノシロ、タコ、ハゼ、ベラ、メゴチ、メジナが釣れました。,中潮,2021-04-09 18:15:00
daikoku,晴,15.5,340.0,また、日中の「釣り方制限」に対するご協力も頂き、ありがとうございました。本日の大黒は、朝晩は冷え込んでいるものの、日差しに温かさを感じる一日となりました。釣果は、サビキ釣りで限られた場所ですが、アジ、イワシが釣れご家族づれにも楽しんで頂けました。ナイトゲ−ムでは、メバルが釣れています。また、メジナを専門に狙われている方は好調で、良型があがっています。明日は一日晴れ、最高気温は17°Cの予報ですが、朝夕は、まだ寒さを感じますので上着が必要です。,大潮,2021-04-10 19:35:00
honmoku,晴,15.0,159.0,,大潮,
isogo,晴,16.0,271.0,東向きの風が吹き続く寒い一日でした。釣果は南桟橋で、アジ、イシモチ、イワシ、ウミタナゴ、カサゴ、カレイ、ギンポ、コノシロ、サバ、シロギス、ハゼ、フグ、ベラ、メゴチ、メジナ、メバルが、中央で、イワシ、ソイが、東桟橋では、カサゴ、カレイ、クロダイ、コノシロ、シロギス、ソイ、ハゼ、フグ、ベラ、メゴチ、メジナ、メバルが釣れました。,大潮,2021-04-10 18:20:00
daikoku,晴,16.0,382.0,本日の大黒は、風が穏やかで日差しに温かさを感じられる一日となりました。釣果は、サビキ釣りで限られた場所ですが、イワシ、コノシロが釣れて楽しんで頂けました。夕方には、アジも釣れています。また、メジナを専門に狙われている方は好調で、多い方で5匹あがっています。明日は晴れの予報ですが、朝夕の寒暖差はありますので、厚着がお勧めです。,大潮,2021-04-11 19:41:00
honmoku,晴,15.0,224.0,,大潮,
isogo,晴,16.0,341.0,日中は風も波も穏やかな陽射しの中で、夕方は少し肌寒く感じましたが天気が崩れることなく釣りを楽しんで頂けたと思います。釣果は南桟橋で、アジ、イワシ、ウミタナゴ、カサゴ、キジハタ、クロダイ、コノシロ、メゴチ、メジナ、メバル等が、中央で、イシモチ、サバが東桟橋では、イワシ、カサゴ、クロダイ、コノシロ、サバ、シロギス、メゴチ、メジナが釣れました。,大潮,2021-04-11 18:29:00
daikoku,晴,16.0,226.0,今日の大黒は、日差しに春を感じられる穏やかな一日となりました。釣果は、サビキ釣りで限られた場所ですが、イワシ、アジが釣れています。また、エギングでシリヤケイカを専門に狙われている方は好調で、良型が数を伸ばしました。餌釣りのメジナ、クロダイですが、年間大物賞候補の42cmメジナがあがっています。明日は最高気温17°Cの予報ですが、昼前から弱雨が降る予想なので、雨具の準備が必要です。,大潮,2021-04-12 19:27:00
honmoku,晴,15.0,87.0,,大潮,
isogo,晴,16.0,126.0,釣果は交互に釣れる日と釣れない日が訪れる様で今日は比較的に良く連日アジとイワシ・コノシロやメジナは釣れ続いています、他にカサゴ、シロギス、メバルやクロダイが顔を見せてくれました。南桟橋で、アジ、イワシ、ウミタナゴ、カサゴ、クロダイ、コノシロ、メジナ、メバル等が、中央で、ウミタナゴが東桟橋では、アジ、カサゴ、キジハタ、カワハギ、クロダイ、コノシロ、シロギス、ハゼ、メジナ、メバルが釣れました。明日は天候が荒れそうです、予報を確認し無理せずお出かけ下さい。,大潮,2021-04-12 18:10:00
daikoku,雨,16.0,104.0,朝から厚い雲に覆われて、雨が降る時間帯も有りました。南西風も強めに吹いて、桟橋はタフなコンディションでした。シリヤケイカが盛期に突入して、カラフルな餌木を駆使して釣果が出ています。サビキ釣りのアジは、生憎の雨が降り出した夕まずめに回って来て、まとまって釣れました。落とし込み釣りのクロダイは、50僂梁膩燭鯑に数が出ました。明日も不安定な天気で、朝・晩は雨が降ります、雨具のご用意をお願い致します。風も早朝から南西の強風が吹いて、昼を境に風向きが北東に変わり、次第に強くなっていきます。日中の最高気温は、21°Cまで上がる予報になっています。,大潮,2021-04-13 19:13:00
honmoku,雨,16.0,28.0,,大潮,
isogo,雨,16.5,34.0,朝から風が強く、閉場前には雨も降りだした釣り辛い一日となってしまいました。釣果としてはメジナが好調の様です。南桟橋で、アジ、イワシ、ウミタナゴ、カサゴ、コノシロ、サバ、ハゼ、メバル等が、中央で、イワシが東桟橋では、カサゴ、コノシロ、サバ、シロギス、メジナ、メバルが釣れました。,大潮,2021-04-13 18:15:00
daikoku,雨,16.5,98.0,朝から雨が降り、南西風も強めに吹く悪状況の中、ヘチ釣りのクロダイには良かったようで数が出ました。サビキ釣りでは、シコイワシは良かったのですが、夕まづめのアジは、強い北風と波も高くなり、良い結果が出ませんでした。シリヤケイカの好釣は続いています。閉場間際は真っ暗になりますので、ヘッドライト等の照明器具をご用意下さい。明日は晴れの予報が出ています。,中潮,2021-04-14 19:30:00
honmoku,雨,15.5,32.0,,中潮,
isogo,雨,16.5,30.0,雨が降ったり止んだり夕方から風も強くなり、厳しい一日となりましたがアジの数が伸びました。南桟橋で、アジ、ウミタナゴ、カサゴ、コノシロ、タコ、メジナ、メバル等が、中央で、アジが東桟橋では、アジ、クロダイ、コノシロ、スズキ、メジナ、メバルが釣れました。,中潮,2021-04-14 18:10:00
daikoku,晴,16.0,234.0,朝は冷え込みましたが、日中は暖かく穏やかな天気になりました。夕マズメは冷たい風が吹き肌寒く感じました。釣果ですが、最近好調のシリヤケイカは本日も数が出ました。その他の釣りでは、クロダイの落とし込みが好調で、サビキ釣りは午後からイワシが好調でした。ルアー釣りでは、ヒラメが上がっていました。明日は日中は暖かくなる予報が出ていますが、朝夕は冷え込みますので、上着の用意をお忘れなくお越し下さい。,中潮,2021-04-15 19:56:00
honmoku,晴,16.0,72.0,,中潮,
isogo,晴,15.5,113.0,気温も少し低く肌寒い一日となりました。釣果ですがアジは昨日よりは、数は減っていますが釣れています。東桟橋奥では、クロダイが7枚上がりました。南桟橋で、アジ、ウミタナゴ、カサゴ、コノシロ、サバ、メジナ、メバル等が、中央で、アジ、タコが東桟橋では、クロダイ、コノシロ、シロギス、メジナ、メバルが釣れました。,中潮,2021-04-15 18:31:00
daikoku,曇,16.0,226.0,今日の大黒は、朝は冷えましたが、日中は暖かくなり釣り日和となりました。釣果は、午前中にコブダイ61cmが、かぶせ釣りで上がっていました。サビキでのイワシが好調で100匹を超える釣果をお持ちの方が数名いました。エギングのシリヤケイカがいよいよシーズンのようで釣果がでてきています。明日は一日雨予報となっていますので、雨具をお忘れなくお持ちください。また、朝夕はまだ冷えますので、上着の用意もお忘れなくお越し下さい。,中潮,2021-04-16 19:37:00
honmoku,曇,15.5,80.0,,中潮,
isogo,曇,16.0,101.0,釣果は交互に釣れる日と釣れない日が訪れる様で今日は比較的に良かった日に該当しました。連日アジとコノシロは釣れ続いています、他にエギで初シリヤケイカ、イワシ、カサゴ、イシモチ、シロギス、メバル、クロダイ、沖アミ餌で大型メジナが顔を見せてくれました。南桟橋で、アジ、イワシ、ウミタナゴ、カサゴ、クロダイ、コノシロ、サバ、メジナ、メバル等が、中央で、アナゴ、イシモチ、ウミタナゴ、マダイが東桟橋では、アジ、イカ、イシモチ、ウミタナゴ、クロダイ、コノシロ、サバ、シロギス、タコ、ハゼ、メゴチ、メジナが釣れました。*明日は朝から雨、風も強まる予報です、外出は控えましょう。,中潮,2021-04-16 18:20:00
daikoku,雨,16.0,205.0,午前中は何とかお天気はもってくれましたが、午後からは雲も厚くなり小雨交じりのお天気となってしまいました。釣果はサビキ釣りのシコイワシが好調で時折、良型のコノシロも交じり初心者やファミリーの方もお楽しみ頂けたと思います。アジはポツポツと終日釣れていました。コマセをこまめに打ち込んでいる方が数を伸ばしています。ここ数日、数は多くはありませんが毎日ヒラメが釣れています。狙ってみるのも面白いと思います。エギングのシリヤケイカがいよいよシーズンインし毎日釣果が伸びていますが、明日は予約状況から開場早々「釣り方制限」になる可能性が高くなっています。「釣り方制限」になった場合はアンダースローでの投入となります。ご了承下さい。,中潮,2021-04-17 19:45:00
honmoku,雨,15.5,70.0,,中潮,
isogo,雨,16.5,71.0,釣果は交互に釣れる日と釣れない日が訪れる様で、今日は後者の不釣で、連日のアジとコノシロは数は伸びず釣れてはいます、他にサビキではイワシやサバ、メジナやクロダイが顔を見せてくれました。南桟橋で、アジ、イワシ、ウミタナゴ、カサゴ、コノシロ、サバ、ハゼ、ベラ、メジナ等が、中央で、コノシロが東桟橋では、アジ、カサゴ、クロダイ、コノシロ、サバ、ハゼ、ベラ、メゴチ、メバルが釣れました。,中潮,2021-04-17 18:10:00
daikoku,晴,16.5,400.0,朝方は曇っていたもののその後晴れましたが、南西の風が吹きつけ1日中釣りづらい日でした。釣果は、カタクチイワシが場所を変えながら釣り続け好調でした。餌木やヘチ釣りのお客さまはアタリが取りづらいなか釣果はありました。また、年間大物賞候補となるタコ(2.59kg)が釣れました。さらに、暗くなり始めてからカサゴやメバルが釣れていました。これからさらに日がのびるとナイトゲームもできなくなりますのでいまのうちにお楽しみください。閉場間際は真っ暗になりますので、ヘッドライト等の照明器具をご用意下さい。明日は晴れで風も弱く、最高気温が20°Cほどまであがる予報になっています。,小潮,2021-04-18 19:39:00
honmoku,晴,15.5,244.0,,小潮,
isogo,晴,16.0,316.0,閉鎖を心配するような南寄りの風が一日中吹き続け、釣り辛く釣果の出ない日となりました。明日は風も収まって来るようです。南桟橋で、アジ、イワシ、ウミタナゴ、カサゴ、コノシロ、サバ、メジナ等が、中央で、アジ、イワシ、コノシロが東桟橋では、イワシ、コノシロ、カサゴ、クロダイ、サバ、シロギス、ハゼ、ベラ、メゴチ、メバルが釣れました。,小潮,2021-04-18 18:33:00
daikoku,晴,16.5,226.0,朝方は肌寒く感じられましたが、日中は穏やかな釣り日和となりました。釣果は、カタクチイワシが釣り続け好調でした。シリヤケイカのエギングも、日々数を伸ばしています。さらに、暗くなり始めてからメバルが釣れていました。閉場間際は真っ暗になりますので、ナイトゲームをされる方はヘッドライト等の照明器具をご用意下さい。明日も晴れて、気温が20度以上になる予報です。調節のできる服装がお勧めです。,小潮,2021-04-19 19:59:00
honmoku,晴,15.5,85.0,,小潮,
isogo,晴,16.0,111.0,昨日とは打って変わり、穏やかな釣り日和となりました。釣果は、コノシロの群れが入り、狙い魚の邪魔をされる方も多かったようです。南桟橋で、アジ、イワシ、ウミタナゴ、コノシロ、メジナ、メバル等、中央で、イワシ、コノシロ、東桟橋では、クロダイ、コノシロ、シロギス、メジナ、カサゴ、メバルが釣れました。,小潮,2021-04-19 18:24:00
daikoku,晴,17.0,267.0,午後から南寄りの風が吹きましたが、さわやかな晴天で、桟橋では気持ちよく過ごせました。イワシが内側を中心に回って来て、足元で数がまとまって釣れました。そのイワシを追って来た、ヒラメとスズキが釣れています。様々なカラーの餌木を使って、シリヤケイカが好調に釣れ続けています。18:00以降は暗くなりますので、ナイトゲームをされるお客様は照明器具をご用意下さい。明日も穏やかに晴れて、気温が22°Cまで上がりそうです。,小潮,2021-04-20 19:28:00
honmoku,晴,16.0,127.0,,小潮,
isogo,晴,16.0,132.0,終日天候に恵まれた暖かな釣り日和でした。釣果は南桟橋でアジ、イワシ、ウミタナゴ、カサゴ、コノシロ、サバ、シロギス、ハゼ、メゴチ、メバルが中央でシロギスが東桟橋ではカレイ、クロダイ、コノシロ、シロギス、タコ、メジナが釣れました。明日も雨の心配は無さそうです。無理せずお出かけ下さい。,小潮,2021-04-20 18:20:00
daikoku,晴,17.0,270.0,予報通り日中はグングン気温が上がり、汗ばむほどの陽気となりました。風もさほど気にならず、気持ちの良い釣り日和となりました。釣果ですが、シコイワシは桟橋全体で鈴なりで釣れ続けていました。アジの好釣果が期待できる濁り潮が入り、サイズは小ぶりなアジが多いながらも足元でも時間を問わずポツポツと釣れていました。シリヤケイカも順調に数を伸ばしましたが好不調が分かれていたようです。桟橋にイカ墨跡がたくさん残っていますので、釣り上げられた際にはイカ墨攻撃に気を付けて頂き、早めに桟橋を海水で洗い流して頂きます様、御協力をお願い致します。明日も晴れて、更に気温が上がるようですので細めな水分補給をお願い致します。日没以降は急速に暗くなりますので、閉場まで釣りをされるお客様は照明器具をご用意下さい。,長潮,2021-04-21 19:38:00
honmoku,晴,16.0,134.0,,長潮,
isogo,晴,16.5,135.0,初夏を感じさせる暑いくらいの一日でした。釣果は南桟橋でアジ、イワシ、ウミタナゴ、カサゴ、コノシロ、サバ、クロダイ、メジナ、メバル等が中央桟橋でアジ、イワシ、コノシロ等が東桟橋ではアジ、イワシ、オオモンハタ、コノシロ、クロダイ、シロギス、タコ、メジナ、メバル等が釣れました。,長潮,2021-04-21 18:25:00
daikoku,晴,17.0,269.0,日中の気温が25°Cを超える暑さとなりましたが、桟橋上は適度な風もあり過ごしやすい一日でした。釣果は、カタクチイワシが全体的に釣れ続き1束(100匹)以上釣られている方が多数いらっしゃいました。シリヤケイカ、クロダイなども好調をキープしています。ヒラメは、イワシの泳がせでの釣果です。明日も晴れの予報で釣り日和となりそうです。お越しの際は、充分な感染症対策をして頂き入場時には検温のご協力をお願い致します。,若潮,2021-04-22 19:22:00
honmoku,晴,17.0,105.0,,若潮,
isogo,晴,16.5,123.0,晴れて良い天気でしたが、昼頃から風が強まり、夕方近くには肌寒くも感じるような一日でした。釣果の方は、午前中からアジ、コノシロは良く、投げ釣りでクロダイが出ました。ルアーでマゴチも出ましたが、何故か浮きフカセのメジナは低迷が続いています。南桟橋で、アジ、コノシロ、ウミタナゴ、タコ、メジナ、シロギス、カサゴ、メバル等が、中央で、アナゴ、コノシロ、カサゴ等が東桟橋では、クロダイ、メジナ、コノシロ、シロギス、カサゴ、メバルが釣れました。,若潮,2021-04-22 18:32:00
daikoku,晴,17.0,249.0,今日の大黒は、昨日までの暑さが一段落して、日中は快適な陽気となりました。釣果は、サビキ釣りでのカタクチイワシが好調で、100匹を超えるイワシを多くの方がお持ちでした。エギングのシリヤケイカは、シーズンインのようで釣果がでてきています。また、イワシの泳がせ釣りで、スズキ、ヒラメ、サバがあがっていました。明日も晴れの予報となっていますが、一日の寒暖差が大きくなるので、調整しやすい服装をご準備ください。明日は、予約状況から開場早々「釣り方制限」になる可能性が高くなっています。「釣り方制限」になった場合は、アンダースローでの投入となりますので、ご了承下さい。,中潮,2021-04-23 19:30:00
honmoku,晴,16.0,103.0,,中潮,
isogo,晴,16.8,106.0,一日晴れましたが、昨日までとは違って風の冷たい日となりました。明日も良い天気に恵まれるようで、混雑が予想されます。HP等で確認し無理せずお出かけ下さい。釣果は南桟橋で、アジ、イシモチ、イワシ、ウミタナゴ、カサゴ、コノシロ、シロギス、メジナ、メバルが、中央で、イシモチ、コノシロが、東桟橋では、クロダイ、アジ、コノシロ、サバ、メジナ等が釣れました。,中潮,2021-04-23 18:35:00
daikoku,晴,17.0,344.0,穏やかなお天気で釣り日和となりました。釣果はサビキ釣りのカタクチイワシが好調でした。ファミリーや初心者にもお楽しみいただけたと思います。珍しく、サヨリが顔を見せてくれました。まだ数は少ないようですが居ついてくれるといいですね。エギングのシリヤケイカが釣れていますが、明日は予約状況から開場早々「釣り方制限」になる可能性が高くなっています。「釣り方制限」になった場合はアンダースローでの投入となります。ご了承下さい。,中潮,2021-04-24 19:45:00
honmoku,晴,16.5,231.0,,中潮,
